{
  "$schema": "http://json-schema.org/draft-07/schema#",
  "title": "Theme",
  "type": "object",
  "properties": {
    "name": {
      "type": "string",
      "description": "The user-facing name of the theme."
    },
    "titlebar_bg": { "$ref": "#/definitions/color" },
    "titlebar_border": { "$ref": "#/definitions/color" },
    "titlebar_text": { "$ref": "#/definitions/color" },
    "titlebar_hover_bg": { "$ref": "#/definitions/color" },
    "titlebar_brand_text": { "$ref": "#/definitions/color" },
    "sidebar_bg": { "$ref": "#/definitions/color" },
    "sidebar_border": { "$ref": "#/definitions/color" },
    "sidebar_text_dir": { "$ref": "#/definitions/color" },
    "sidebar_text_file": { "$ref": "#/definitions/color" },
    "sidebar_selected_bg": { "$ref": "#/definitions/color" },
    "sidebar_hover_bg": { "$ref": "#/definitions/color" },
    "tabbar_bg": { "$ref": "#/definitions/color" },
    "tabbar_border": { "$ref": "#/definitions/color" },
    "tab_active_bg": { "$ref": "#/definitions/color" },
    "tab_inactive_bg": { "$ref": "#/definitions/color" },
    "tab_text": { "$ref": "#/definitions/color" },
    "breadcrumb_bg": { "$ref": "#/definitions/color" },
    "breadcrumb_border": { "$ref": "#/definitions/color" },
    "breadcrumb_text": { "$ref": "#/definitions/color" },
    "editor_bg": { "$ref": "#/definitions/color" },
    "gutter_bg": { "$ref": "#/definitions/color" },
    "gutter_border": { "$ref": "#/definitions/color" },
    "active_line_bg": { "$ref": "#/definitions/color" },
    "line_number_active": { "$ref": "#/definitions/color" },
    "line_number_inactive": { "$ref": "#/definitions/color" },
    "selection_bg": { "$ref": "#/definitions/color" },
    "cursor_color": { "$ref": "#/definitions/color" },
    "syntax_default": { "$ref": "#/definitions/color" },
    "syntax_keyword": { "$ref": "#/definitions/color" },
    "syntax_type": { "$ref": "#/definitions/color" },
    "syntax_number": { "$ref": "#/definitions/color" },
    "syntax_string": { "$ref": "#/definitions/color" },
    "syntax_comment": { "$ref": "#/definitions/color" },
    "syntax_attribute": { "$ref": "#/definitions/color" },
    "syntax_namespace": { "$ref": "#/definitions/color" },
    "syntax_enum_member": { "$ref": "#/definitions/color" },
    "syntax_parameter": { "$ref": "#/definitions/color" },
    "syntax_variable": { "$ref": "#/definitions/color" },
    "syntax_property": { "$ref": "#/definitions/color" },
    "syntax_macro": { "$ref": "#/definitions/color" },
    "syntax_operator": { "$ref": "#/definitions/color" },
    "scrollbar_track": { "$ref": "#/definitions/color" },
    "scrollbar_border": { "$ref": "#/definitions/color" },
    "scrollbar_thumb": { "$ref": "#/definitions/color" },
    "scrollbar_thumb_hover": { "$ref": "#/definitions/color" },
    "statusbar_bg": { "$ref": "#/definitions/color" },
    "statusbar_border": { "$ref": "#/definitions/color" },
    "statusbar_text": { "$ref": "#/definitions/color" },
    "modal_bg": { "$ref": "#/definitions/color" },
    "modal_border": { "$ref": "#/definitions/color" },
    "modal_text_title": { "$ref": "#/definitions/color" },
    "modal_text_normal": { "$ref": "#/definitions/color" },
    "modal_text_muted": { "$ref": "#/definitions/color" },
    "button_bg": { "$ref": "#/definitions/color" },
    "button_hover_bg": { "$ref": "#/definitions/color" },
    "button_border": { "$ref": "#/definitions/color" },
    "button_text": { "$ref": "#/definitions/color" },
    "dropdown_hover_bg": { "$ref": "#/definitions/color" }
  },
  "required": [
    "name",
    "titlebar_bg",
    "titlebar_border",
    "titlebar_text",
    "titlebar_hover_bg",
    "titlebar_brand_text",
    "sidebar_bg",
    "sidebar_border",
    "sidebar_text_dir",
    "sidebar_text_file",
    "sidebar_selected_bg",
    "sidebar_hover_bg",
    "tabbar_bg",
    "tabbar_border",
    "tab_active_bg",
    "tab_inactive_bg",
    "tab_text",
    "breadcrumb_bg",
    "breadcrumb_border",
    "breadcrumb_text",
    "editor_bg",
    "gutter_bg",
    "gutter_border",
    "active_line_bg",
    "line_number_active",
    "line_number_inactive",
    "selection_bg",
    "cursor_color",
    "syntax_default",
    "syntax_keyword",
    "syntax_type",
    "syntax_number",
    "syntax_string",
    "syntax_comment",
    "syntax_attribute",
    "syntax_namespace",
    "syntax_enum_member",
    "syntax_parameter",
    "syntax_variable",
    "syntax_property",
    "syntax_macro",
    "syntax_operator",
    "scrollbar_track",
    "scrollbar_border",
    "scrollbar_thumb",
    "scrollbar_thumb_hover",
    "statusbar_bg",
    "statusbar_border",
    "statusbar_text",
    "modal_bg",
    "modal_border",
    "modal_text_title",
    "modal_text_normal",
    "modal_text_muted",
    "button_bg",
    "button_hover_bg",
    "button_border",
    "button_text",
    "dropdown_hover_bg"
  ],
  "definitions": {
    "color": {
      "type": "array",
      "minItems": 4,
      "maxItems": 4,
      "items": {
        "type": "number",
        "minimum": 0.0,
        "maximum": 1.0
      },
      "description": "RGBA color representation where each component is a float from 0.0 to 1.0."
    }
  }
}
