{
  "$schema": "./theme.schema.json",
  "name": "Dark Theme",
  "titlebar_bg": [0.063, 0.063, 0.063, 1.0],
  "titlebar_border": [0.153, 0.153, 0.165, 1.0],
  "titlebar_text": [0.71, 0.71, 0.75, 1.0],
  "titlebar_hover_bg": [0.12, 0.12, 0.14, 0.5],
  "titlebar_brand_text": [0.38, 0.69, 0.94, 1.0],
  "sidebar_bg": [0.063, 0.063, 0.063, 1.0],
  "sidebar_border": [0.153, 0.153, 0.165, 1.0],
  "sidebar_text_dir": [0.898, 0.898, 0.902, 1.0],
  "sidebar_text_file": [0.71, 0.71, 0.75, 1.0],
  "sidebar_selected_bg": [0.094, 0.094, 0.098, 1.0],
  "sidebar_hover_bg": [0.12, 0.12, 0.14, 0.5],
  "tabbar_bg": [0.063, 0.063, 0.063, 1.0],
  "tabbar_border": [0.153, 0.153, 0.165, 1.0],
  "tab_active_bg": [0.094, 0.094, 0.098, 1.0],
  "tab_inactive_bg": [0.063, 0.063, 0.063, 1.0],
  "tab_text": [0.898, 0.898, 0.902, 1.0],
  "breadcrumb_bg": [0.094, 0.094, 0.098, 1.0],
  "breadcrumb_border": [0.153, 0.153, 0.165, 1.0],
  "breadcrumb_text": [0.44, 0.44, 0.48, 1.0],
  "editor_bg": [0.094, 0.094, 0.098, 1.0],
  "gutter_bg": [0.094, 0.094, 0.098, 1.0],
  "gutter_border": [0.153, 0.153, 0.165, 0.0],
  "active_line_bg": [0.153, 0.153, 0.165, 0.3],
  "line_number_active": [0.898, 0.898, 0.902, 1.0],
  "line_number_inactive": [0.322, 0.322, 0.357, 1.0],
  "selection_bg": [0.118, 0.227, 0.541, 0.4],
  "cursor_color": [0.231, 0.510, 0.965, 1.0],
  "syntax_default": [0.898, 0.898, 0.902, 1.0],
  "syntax_keyword": [0.957, 0.247, 0.369, 1.0],
  "syntax_type": [0.984, 0.749, 0.141, 1.0],
  "syntax_number": [0.976, 0.451, 0.086, 1.0],
  "syntax_string": [0.063, 0.725, 0.506, 1.0],
  "syntax_comment": [0.322, 0.322, 0.357, 1.0],
  "syntax_attribute": [0.231, 0.510, 0.965, 1.0],
  "syntax_namespace": [0.55, 0.71, 0.80, 1.0],
  "syntax_enum_member": [0.976, 0.451, 0.086, 1.0],
  "syntax_parameter": [0.820, 0.573, 0.373, 1.0],
  "syntax_variable": [0.898, 0.898, 0.902, 1.0],
  "syntax_property": [0.545, 0.753, 0.984, 1.0],
  "syntax_macro": [0.231, 0.510, 0.965, 1.0],
  "syntax_operator": [0.898, 0.898, 0.902, 1.0],
  "scrollbar_track": [0.063, 0.063, 0.063, 1.0],
  "scrollbar_border": [0.153, 0.153, 0.165, 1.0],
  "scrollbar_thumb": [0.153, 0.153, 0.165, 0.4],
  "scrollbar_thumb_hover": [0.153, 0.153, 0.165, 0.7],
  "statusbar_bg": [0.063, 0.063, 0.063, 1.0],
  "statusbar_border": [0.153, 0.153, 0.165, 1.0],
  "statusbar_text": [0.44, 0.44, 0.48, 1.0],
  "modal_bg": [0.063, 0.063, 0.063, 1.0],
  "modal_border": [0.153, 0.153, 0.165, 1.0],
  "modal_text_title": [0.898, 0.898, 0.902, 1.0],
  "modal_text_normal": [0.71, 0.71, 0.75, 1.0],
  "modal_text_muted": [0.44, 0.44, 0.48, 1.0],
  "button_bg": [0.094, 0.094, 0.098, 1.0],
  "button_hover_bg": [0.12, 0.12, 0.14, 1.0],
  "button_border": [0.153, 0.153, 0.165, 1.0],
  "button_text": [0.898, 0.898, 0.902, 1.0],
  "dropdown_hover_bg": [0.094, 0.094, 0.098, 1.0]
}
